{
  "Title": "Clearing Entry",
  "Short Title": "Clearing Entry",
  "Overall Purpose": "Help founders clear residue and enter a new space with integrity.",
  "Why This Matters": "Integrity Is the Growth Strategy and The System Walks With Us remind us that clean thresholds create coherent work.",
  "When To Use This Protocol": "Before starting a new session, call, or deep work block.",
  "Overall Outcomes": {
    "Poor": "Residue carried forward, clarity lost.",
    "Expected": "Basic reset achieved.",
    "Excellent": "Clear entry becomes habitual.",
    "Transcendent": "Entry thresholds transform the whole field."
  },
  "Themes": [
    {
      "Name": "Name Residue",
      "Purpose of This Theme": "Acknowledge what you’re carrying.",
      "Why This Matters": "What is named can be released.",
      "Outcomes": {
        "Poor": { "Present pattern": "Ignore residue.", "Immediate cost": "Clutter persists.", "30-90 day system effect": "Coherence declines.", "Signals": "Tension carried.", "Edge condition": "Over-identification.", "Example moves": "Say what lingers.", "Future effect": "Baggage builds." },
        "Expected": { "Present pattern": "Residue noticed.", "Immediate cost": "Relief begins.", "30-90 day system effect": "Clarity restored.", "Signals": "Relaxed posture.", "Edge condition": "Avoid blame.", "Example moves": "Write a quick note.", "Future effect": "Clarity maintained." },
        "Excellent": { "Present pattern": "Residue clearing consistent.", "Immediate cost": "Not applicable", "30-90 day system effect": "Integrity grows.", "Signals": "Energy shifts.", "Edge condition": "No perfectionism.", "Example moves": "Simple release ritual.", "Future effect": "Flow improves." },
        "Transcendent": { "Present pattern": "Thresholds honored deeply.", "Immediate cost": "Not applicable", "30-90 day system effect": "Coherence field resets.", "Signals": "Ease and lightness.", "Edge condition": "Avoid bypassing.", "Example moves": "Speak clearing aloud.", "Future effect": "System stays clean." }
      },
      "Guiding Questions": ["What am I carrying right now?", "What can I set down?", "What would be clean to leave behind?"]
    },
    {
      "Name": "Bless Transition",
      "Purpose of This Theme": "Honor the shift into new space.",
      "Why This Matters": "Blessing reinforces coherence.",
      "Outcomes": {
        "Poor": { "Present pattern": "Skip transition.", "Immediate cost": "Disconnection.", "30-90 day system effect": "Coherence weakens.", "Signals": "Rushed tone.", "Edge condition": "Avoid shallow ritual.", "Example moves": "Jump without pause.", "Future effect": "Residue persists." },
        "Expected": { "Present pattern": "Bless transition simply.", "Immediate cost": "Relief felt.", "30-90 day system effect": "Clarity improves.", "Signals": "Calm tone.", "Edge condition": "Avoid dramatizing.", "Example moves": "Say thanks.", "Future effect": "Coherence grows." },
        "Excellent": { "Present pattern": "Blessing normalized.", "Immediate cost": "Not applicable", "30-90 day system effect": "Integrity expands.", "Signals": "Ease visible.", "Edge condition": "Not empty ritual.", "Example moves": "Group blessing.", "Future effect": "System coherence." },
        "Transcendent": { "Present pattern": "Blessing as field anchor.", "Immediate cost": "Not applicable", "30-90 day system effect": "Wholeness emerges.", "Signals": "Shared reverence.", "Edge condition": "Avoid bypass.", "Example moves": "Bless as collective.", "Future effect": "Field coherence grows." }
      },
      "Guiding Questions": ["What am I entering?", "How do I bless this moment?", "What does blessing shift in me?"]
    },
    {
      "Name": "Set Intention",
      "Purpose of This Theme": "Name what this space is for.",
      "Why This Matters": "Intention guides coherence.",
      "Outcomes": {
        "Poor": { "Present pattern": "Skip intention.", "Immediate cost": "Aimless.", "30-90 day system effect": "Fragmentation.", "Signals": "Confused energy.", "Edge condition": "Over-prescribe.", "Example moves": "Dive in unclear.", "Future effect": "System drifts." },
        "Expected": { "Present pattern": "Intention named.", "Immediate cost": "Clarity grows.", "30-90 day system effect": "Coherence improves.", "Signals": "Focused eyes.", "Edge condition": "Avoid rigidity.", "Example moves": "Name goal.", "Future effect": "Trust builds." },
        "Excellent": { "Present pattern": "Intention clear.", "Immediate cost": "Not applicable", "30-90 day system effect": "Alignment expands.", "Signals": "Calm focus.", "Edge condition": "Avoid forcing.", "Example moves": "Share intention.", "Future effect": "System coheres." },
        "Transcendent": { "Present pattern": "Intention as field compass.", "Immediate cost": "Not applicable", "30-90 day system effect": "Wholeness grows.", "Signals": "Shared clarity.", "Edge condition": "No bypass.", "Example moves": "Align as group.", "Future effect": "Field coherence." }
      },
      "Guiding Questions": ["What is this space for?", "How do I hold it?", "What future does this open?"]
    },
    {
      "Name": "Release Old Energy",
      "Purpose of This Theme": "Discharge what doesn’t belong.",
      "Why This Matters": "Old energy blocks flow.",
      "Outcomes": {
        "Poor": { "Present pattern": "Energy carried.", "Immediate cost": "Cluttered space.", "30-90 day system effect": "Trust erodes.", "Signals": "Restless body.", "Edge condition": "Avoid denial.", "Example moves": "Skip release.", "Future effect": "Stagnation." },
        "Expected": { "Present pattern": "Energy released.", "Immediate cost": "Relief felt.", "30-90 day system effect": "Clarity expands.", "Signals": "Relaxation.", "Edge condition": "Not over-dramatic.", "Example moves": "Stretch/shake.", "Future effect": "Ease grows." },
        "Excellent": { "Present pattern": "Release normalized.", "Immediate cost": "Not applicable", "30-90 day system effect": "Integrity builds.", "Signals": "Ease visible.", "Edge condition": "Avoid bypass.", "Example moves": "Team release.", "Future effect": "System clears." },
        "Transcendent": { "Present pattern": "Release as ritual.", "Immediate cost": "Not applicable", "30-90 day system effect": "Coherence strengthens.", "Signals": "Shared stillness.", "Edge condition": "Not avoidance.", "Example moves": "Collective release.", "Future effect": "Wholeness grows." }
      },
      "Guiding Questions": ["What old energy lingers?", "How can I release it now?", "What changes when it’s gone?"]
    },
    {
      "Name": "Open Freshly",
      "Purpose of This Theme": "Enter as if new.",
      "Why This Matters": "Fresh entry resets coherence.",
      "Outcomes": {
        "Poor": { "Present pattern": "Carry old baggage.", "Immediate cost": "Dull entry.", "30-90 day system effect": "System stagnates.", "Signals": "Heavy energy.", "Edge condition": "Avoid pretending.", "Example moves": "Repeat old patterns.", "Future effect": "Field closes." },
        "Expected": { "Present pattern": "Fresh start attempted.", "Immediate cost": "Energy lightens.", "30-90 day system effect": "Trust builds.", "Signals": "Smile returns.", "Edge condition": "Not forced.", "Example moves": "Simple reset ritual.", "Future effect": "Clarity grows." },
        "Excellent": { "Present pattern": "Freshness consistent.", "Immediate cost": "Not applicable", "30-90 day system effect": "Integrity deepens.", "Signals": "Clear focus.", "Edge condition": "Avoid superficiality.", "Example moves": "Group acknowledgment.", "Future effect": "System coheres." },
        "Transcendent": { "Present pattern": "Freshness as cultural norm.", "Immediate cost": "Not applicable", "30-90 day system effect": "Wholeness grows.", "Signals": "Shared joy.", "Edge condition": "Avoid denial.", "Example moves": "Field-wide renewal.", "Future effect": "System regenerates." }
      },
      "Guiding Questions": ["What makes this entry fresh?", "How can I step in as new?", "What field opens with this entry?"]
    }
  ],
  "Completion Prompts": ["What shifted as I entered?", "What residue cleared?", "How does this threshold change me?"],
  "Version": "1.0.0",
  "Created At": "2025-09-13",
  "Protocol ID": "clearing_entry",
  "Category": "entry",
  "Metadata": {
    "Complexity": 1,
    "Readiness Stage": "Explore",
    "Modes": ["Full Walk", "Theme-Only"],
    "Estimated Time": "5–10 minutes",
    "Tone Markers": ["light", "clear"],
    "Primary Scenarios": ["session entry"],
    "Related Protocols": [],
    "Tags": ["entry", "residue-clearing"],
    "Algorithm": { "Present": false },
    "Stones": ["integrity-is-the-growth-strategy", "the-system-walks-with-us"],
    "Fields": ["entry", "integrity"],
    "Bridges": []
  }
}
